{
  "question": "Associations in the superclass are not inherited.",
  "numberOfComments": 1,
  "answers": [
    {
      "answer": "Yes",
      "correct": false
    },
    {
      "answer": "No",
      "correct": true
    }
  ],
  "comments": [
    {
      "author": "Samuele Milan",
      "comment": "All invariants (including associations) are inherited by a subclass.",
      "date": "02-09-2023 00:00:00"
    }
  ],
  "contributors": [
    "Samuele Milan"
  ],
  "id": "z-47-30cc4f31-b1cd-4dc1-8ae9-0ceb37154e38",
  "createdAt": 1691363367006
}
