{
  "question": "The {subset} implementation requires a method to check for the existence of a given link.",
  "numberOfComments": 1,
  "answers": [
    {
      "answer": "Yes",
      "correct": true
    },
    {
      "answer": "No",
      "correct": false
    }
  ],
  "comments": [
    {
      "author": "Samuele Milan",
      "comment": "One of the basic activities that needs to be done is to check the existence of a particular link.",
      "date": "02-09-2023 00:00:00"
    }
  ],
  "contributors": [
    "Samuele Milan"
  ],
  "id": "z-71-9f62f8d7-3afc-46b2-a956-7b5af3baf18e",
  "createdAt": 1691363367006
}
