{
  "question": "Język XSLT:",
  "isMarkdown": false,
  "answers": [
    {
      "answer": "Zaimplementowano wyłącznie po stronie przeglądarki klienta",
      "correct": false,
      "isMarkdown": false
    },
    {
      "answer": "Wspiera rekurencyjne wywoływanie wzorców",
      "correct": true,
      "isMarkdown": false
    },
    {
      "answer": "Umożliwia przetwarzanie dowolnych dokumentów HTML",
      "correct": true,
      "isMarkdown": false
    },
    {
      "answer": "Działa wyłącznie po stronie serwera",
      "correct": false,
      "isMarkdown": false
    }
  ],
  "id": "z-02-bdecf51a-4dfd-4ece-81ea-2f4ad135070a",
  "createdAt": 1707434565194
}
