{
  "question": "One of the most important aspects of usability is the practical usefulness of the thing/service.",
  "numberOfComments": 1,
  "answers": [
    {
      "answer": "Yes",
      "correct": true
    },
    {
      "answer": "No",
      "correct": false
    }
  ],
  "comments": [
    {
      "author": "Samuele Milan",
      "comment": "Practical application is an important assessment factor.",
      "date": "02-09-2023 00:00:00"
    }
  ],
  "contributors": [
    "Samuele Milan"
  ],
  "id": "z-129-b020ee08-5b33-41eb-adef-bd3c9660ad98",
  "createdAt": 1691363367006
}
