{
  "question": "<strong>W których z wymienionych sytuacji mówimy o problemie fantomów?</strong>",
  "isMarkdown": false,
  "answers": [
    {
      "answer": "Użytkownik zobaczył rekord wprowadzony przez innego użytkownika, który nie został zatwierdzony przez COMMIT",
      "correct": false,
      "isMarkdown": false
    },
    {
      "answer": "Rekord został w obrębie jednej transakcji wprowadzony (INSERT) i od razu usunięty (DELETE)",
      "correct": false,
      "isMarkdown": false
    },
    {
      "answer": "W trakcie działania transakcji inna transakcja wykonała INSERT",
      "correct": true,
      "isMarkdown": false
    },
    {
      "answer": "W trakcie działania transakcji inna transakcja wykonała DELETE",
      "correct": false,
      "isMarkdown": false
    }
  ],
  "id": "z-00-7816ffd8-3dac-4670-b743-2b5d7f0d9129",
  "createdAt": 1707647448640
}
