{
  "question": "Classes in Java are presented directly.",
  "numberOfComments": 1,
  "answers": [
    {
      "answer": "Yes",
      "correct": true
    },
    {
      "answer": "No",
      "correct": false
    }
  ],
  "comments": [
    {
      "author": "Samuele Milan",
      "comment": "In Java, we have a special class keyword that allows direct creation of classes.",
      "date": "02-09-2023 00:00:00"
    }
  ],
  "contributors": [
    "Samuele Milan"
  ],
  "id": "z-02-a54e42d2-cdc1-432f-9200-acbd135ff49c",
  "createdAt": 1691363367006
}
