{
  "question": "The SwingWorker class displays the default version of the progress bar.",
  "numberOfComments": 1,
  "answers": [
    {
      "answer": "Yes",
      "correct": false
    },
    {
      "answer": "No",
      "correct": true
    }
  ],
  "comments": [
    {
      "author": "Samuele Milan",
      "comment": "The default implementation of the SwingWorker class does not contain any GUI elements.",
      "date": "02-09-2023 00:00:00"
    }
  ],
  "contributors": [
    "Samuele Milan"
  ],
  "id": "z-155-064bbf65-e3de-4721-b2ed-705c849d6f24",
  "createdAt": 1691363367006
}
