{
  "question": "Relational model uses the concept of object identity.",
  "numberOfComments": 1,
  "answers": [
    {
      "answer": "Yes",
      "correct": false
    },
    {
      "answer": "No",
      "correct": true
    }
  ],
  "comments": [
    {
      "author": "Samuele Milan",
      "comment": "The identity concept of an object exists in an object model, not a relational one.",
      "date": "02-09-2023 00:00:00"
    }
  ],
  "contributors": [
    "Samuele Milan"
  ],
  "id": "z-81-09e3bdb1-3c28-4ef8-bbb3-29631f8dbfe7",
  "createdAt": 1691363367006
}
