{
  "question": "An example of a complex attribute is a double last name.",
  "numberOfComments": 1,
  "answers": [
    {
      "answer": "Yes",
      "correct": false
    },
    {
      "answer": "No",
      "correct": true
    }
  ],
  "comments": [
    {
      "author": "Samuele Milan",
      "comment": "Double surname is not a complex attribute because it is treated as a whole.",
      "date": "02-09-2023 00:00:00"
    }
  ],
  "contributors": [
    "Samuele Milan"
  ],
  "id": "6afa6a43-7ce9-49da-8eb9-314f1632e089",
  "createdAt": 1691363367006
}